{"artifact_status":"reviewed","artifacts":{"short_horizon_events.csv":"619e694178cababfdc6c576a00b2a19561be85d4ce8ea74dc937b2b3b4cda61f","short_horizon_fee_gap.png":"ff2fe442578bd04bfbd6cb099cb2d01d19f6c118cba1e921c65e64be57b2e09c","short_horizon_qa.json":"62a4ab850266ba823a580518a67b43aee821b0b396561066d5c62f67929c4698","short_horizon_report.md":"47eb5bdb98aa35a888943df78eca1e7cd8d25c8bfe438dc45c35f3d0c12f138c","short_horizon_response.png":"2ef9ec2b7da282dccc2bd0ac4dc6f706b393298389620deca3b2f9ef26d5f99a","short_horizon_summaries.csv":"6c8523afc115d448fa0d66a9b7314821ca5e208761adb68eb97f5275e3b76e04","short_horizon_updates.png":"7efeae4b654f55137de04186640b7d3b5674f0663fbd9d3205526bbc59172433"},"contract":{"bootstrap":{"bit_generator":"PCG64","confidence_level":0.95,"minimum_conditional_update_days":10,"minimum_joint_valid_resamples":1900,"pointwise_rank_convention":"central_nearest_rank","resamples":2000,"seed":20260715,"simultaneous_method":"within_direction_max_z","unit":"shock_utc_day"},"cluster_ms":900000,"common_support":"both_streams_through_900000_ms","economic_interpretation_floor_bps":10.0,"fee_gap":"direction_fixed_fee_adjusted_bid_ask_log_ratio","horizons_ms":[30000,60000,120000,180000,300000,600000,900000],"lookback_ms":900000,"price_field":"raw_sqrt_mid","price_orientation":"stablecoin_per_cngn","research_role":"post_hoc_exploratory","response_estimator":"simple_return_bps","shock_threshold_bps":5.0,"stablecoin_parity_assumption":"usdc_equals_usdt","timestamp_tie_policy":"exclude_complete_shock_family_sensitivity"},"parent":{"allowed_claim":"aggregate_leadership_unresolved","article_branch":"leadership_unresolved","artifact_status":"reviewed","base_features_sha256":"47bae897266c00d92823fcae8d004debf9e50d22639ab52c326b121c9b7da23a","bsc_features_sha256":"aba2dbef0548d4bca4882c26f220da14f963c1727bff855cd7532784c2cfaa5c","economic_class":"no_net_return_improvement","manifest_sha256":"adf4fd71fd33604cee70fcba7aa90d2b7763715d3cba68a868d26347c599abfe","schema_version":"2.0.0"},"provenance":{"code_commit":"f4d43e773e4f24923226db86df9c64c9cd616cf3","inputs":{"base_features":{"byte_count":1351276,"sha256":"47bae897266c00d92823fcae8d004debf9e50d22639ab52c326b121c9b7da23a"},"bsc_features":{"byte_count":2845940,"sha256":"aba2dbef0548d4bca4882c26f220da14f963c1727bff855cd7532784c2cfaa5c"},"girum_note":{"byte_count":11387,"sha256":"e401f2ddb91305d209d2183745d61e89e437ae3db054b0d4c11178c7db1f3261"},"parent_manifest":{"byte_count":941232,"sha256":"adf4fd71fd33604cee70fcba7aa90d2b7763715d3cba68a868d26347c599abfe"}},"runtime":{"dejavu_sans_sha256":"3fdf69cabf06049ea70a00b5919340e2ce1e6d02b0cc3c4b44fb6801bd1e0d22","jsonschema":"4.23.0","matplotlib":"3.9.2","numpy":"2.1.1","python":"3.12.1"},"source_dependencies":{"engine/web3_utils.py":"7d61b33297dda366eec8420b546a0cbc8557fd07a9a7bf5d3d5b8577da2cf437","research/cross_pool/bootstrap.py":"d4753eed579d9b97c1d7defe20cf59fe4e8e1e33452802d9d7999b52ba5af3b5","research/cross_pool/contracts.py":"f071934ac312d743600cbbf897fd6b5055412c29fea4c06cb86a806f55b1dc8a","research/cross_pool/event_study.py":"3db552f9e5a059af9ce2dddc6be6009c802b9eaf8bd1d375d407c55a7375f9f8","research/cross_pool/io.py":"e1b54bd2fa82924dbd8811c32dff3309a0a693c89575bfc34f73857c21d8926f","research/cross_pool/short_horizon.py":"1f3de2c8c4d2daee61c3995f8f75263ea6ad86b6e072e6f6dfc2d5fcbd208962","research/cross_pool/short_horizon_artifacts.py":"82855adf2e39e1202456a5337f7ac30c865f1d96b8ea6272e5272d51d9a1aefd","research/cross_pool/short_horizon_inference.py":"00211c73c1efa453a5e6db4c7889ed92930ae89940a02797d70e1ab59da96165","research/cross_pool/short_horizon_manifest.py":"b63f057da52abf6becd7b16750df284baf235253e934f91656eb434515a9310b","research/cross_pool/short_horizon_manifest.schema.json":"799c1a78a09c2174d79f5b013fae889d5176bdae9ff76130f1ba2ba8f574032f","research/cross_pool/short_horizon_parent.py":"89124fe96ce2a984e1f6c03f05af789cc457f56fc32b8f42d2301d687d90e0c6","research/cross_pool/short_horizon_publication.py":"09bcfdd7494b3fd4ac91a86ebd7c58d39d56ea1a2617592abf358b19d60a4793","research/cross_pool/short_horizon_reporting.py":"9cde5245cc8c08b87a43a1b145748e8960aee259879fb29847abe8af4a088c5e","research/scripts/review_cross_pool_short_horizon.py":"3063388237dc40d045cc6ace5a33793d4b0057bd2e5328de9cb3e8f2ee10ff21","research/scripts/run_cross_pool_short_horizon.py":"b38eff21cbde9195742042a25853a0a537835225f737e194fe7ace00b6d13dd7"}},"publication":{"forbidden_claims":["causal_price_discovery","unique_directional_leader","deployable_alpha","toxic_flow_attribution","external_lp_profitability","net_executable_profit"],"parent_decision_unchanged":true,"permitted_claims":["short_horizon_response_profile","update_incidence_latency_staleness_profile","fee_only_cross_venue_gap_profile","girum_method_compatibility"]},"qa":{"counts":[{"detected_shock_count":123,"direction":"bsc_to_base","eligible_shock_count":123,"exclusion_count":0,"same_timestamp_shock_count":0},{"detected_shock_count":197,"direction":"base_to_bsc","eligible_shock_count":197,"exclusion_count":0,"same_timestamp_shock_count":0}],"parent_anchor_reconciled":true,"reasons":[],"status":"pass"},"results":{"cohorts":[{"cohort":"primary","confidence_level":0.95,"direction":"bsc_to_base","eligible_event_count":123,"resamples":2000,"seed":20260715,"shock_day_count":59,"simultaneous_bands":[{"critical_value":2.5541663047205487,"metric":"unconditional_mean_response_bps","points":[{"bootstrap_standard_deviation":0.08300232330154236,"horizon_ms":30000,"lower":-0.268068085097094,"point":-0.056066347706773295,"upper":0.15593538968354745},{"bootstrap_standard_deviation":0.09627218996006938,"horizon_ms":60000,"lower":-0.28157093372602665,"point":-0.035675750048361536,"upper":0.21021943362930356},{"bootstrap_standard_deviation":0.1758045284279442,"horizon_ms":120000,"lower":-0.28238614930429135,"point":0.16664785342364952,"upper":0.6156818561515904},{"bootstrap_standard_deviation":0.1798967207030761,"horizon_ms":180000,"lower":-0.2551270304015532,"point":0.2043591119479673,"upper":0.6638452542974878},{"bootstrap_standard_deviation":0.6817541069519627,"horizon_ms":300000,"lower":-2.4839969139237352,"point":-0.7426835458421832,"upper":0.998629822239369},{"bootstrap_standard_deviation":1.1413335754517826,"horizon_ms":600000,"lower":-2.374396972865037,"point":0.5407587880001342,"upper":3.4559145488653056},{"bootstrap_standard_deviation":1.247636591952218,"horizon_ms":900000,"lower":-2.3084415181934657,"point":0.8782298255072702,"upper":4.064901169208007}],"reason":null,"status":"available","valid_joint_resamples":2000},{"critical_value":2.39646767033042,"metric":"update_incidence","points":[{"bootstrap_standard_deviation":0.031119465851693767,"horizon_ms":30000,"lower":0.0473744256806595,"point":0.12195121951219512,"upper":0.19652801334373074},{"bootstrap_standard_deviation":0.031119465851693767,"horizon_ms":60000,"lower":0.0473744256806595,"point":0.12195121951219512,"upper":0.19652801334373074},{"bootstrap_standard_deviation":0.03178400511993525,"horizon_ms":120000,"lower":0.06204204141027976,"point":0.13821138211382114,"upper":0.21438072281736253},{"bootstrap_standard_deviation":0.03566098159623105,"horizon_ms":180000,"lower":0.07714123652864435,"point":0.16260162601626016,"upper":0.24806201550387597},{"bootstrap_standard_deviation":0.04163192115280432,"horizon_ms":300000,"lower":0.11161256072469752,"point":0.21138211382113822,"upper":0.3111516669175789},{"bootstrap_standard_deviation":0.04435180142703944,"horizon_ms":600000,"lower":0.18639526858845368,"point":0.2926829268292683,"upper":0.3989705850700829},{"bootstrap_standard_deviation":0.04656092982361525,"horizon_ms":900000,"lower":0.2054914077088899,"point":0.3170731707317073,"upper":0.42865493375452474}],"reason":null,"status":"available","valid_joint_resamples":2000},{"critical_value":2.557387642008683,"metric":"conditional_first_update_mean_response_bps","points":[{"bootstrap_standard_deviation":0.611688943096945,"horizon_ms":30000,"lower":-1.8096408993521962,"point":-0.2453151555227166,"upper":1.3190105883067629},{"bootstrap_standard_deviation":0.611688943096945,"horizon_ms":60000,"lower":-1.8096408993521962,"point":-0.2453151555227166,"upper":1.3190105883067629},{"bootstrap_standard_deviation":1.1277404076528994,"horizon_ms":120000,"lower":-1.8602336297142257,"point":1.0238357522111334,"upper":3.9079051341364925},{"bootstrap_standard_deviation":1.0461619366621437,"horizon_ms":180000,"lower":-1.439198476154726,"point":1.236243132204911,"upper":3.911684740564548},{"bootstrap_standard_deviation":1.8045569261216865,"horizon_ms":300000,"lower":-6.996655890085306,"point":-2.381704307920529,"upper":2.233247274244248},{"bootstrap_standard_deviation":3.8014249503172923,"horizon_ms":600000,"lower":-7.105748619944746,"point":2.6159685700201685,"upper":12.337685759985083},{"bootstrap_standard_deviation":3.5367526575716393,"horizon_ms":900000,"lower":-6.662078630807178,"point":2.3827689085078987,"upper":11.427616447822976}],"reason":null,"status":"available","valid_joint_resamples":2000}],"summaries":[{"conditional_first_update_mean_response_bps":-0.2453151555227166,"conditional_first_update_median_delay_ms":3000.0,"conditional_first_update_median_response_bps":-1.8139443659925578,"conditional_first_update_p95_delay_ms":15000.0,"direction_agreement_share":0.04878048780487805,"eligible_event_count":123,"horizon_ms":30000,"mean_fee_gap_closure_bps":0.20614701798799553,"mean_fee_gap_end_bps":-14.980701779498062,"mean_fee_gap_start_bps":-14.774554761510068,"observed_update_day_count":12,"positive_fee_gap_end_share":0.21951219512195122,"positive_fee_gap_start_share":0.22764227642276422,"right_censored_count":108,"shock_day_count":59,"target_end_median_age_ms":1439000.0,"target_end_p95_age_ms":52522000.0,"target_start_median_age_ms":1759000.0,"target_start_p95_age_ms":52492000.0,"unconditional_mean_response_bps":{"lower":-0.22970740752709434,"point":-0.056066347706773295,"upper":0.09624282081546477},"unconditional_median_response_